{
  "apiVersion": "launchroom.vantezzen.io/v1",
  "kind": "RegistryToken",
  "token": "eyJhbGciOiJFUzI1NiIsImtpZCI6ImtkZW1vIiwidHlwIjoiSldUIn0.eyJhY2Nlc3MiOltdfQ.c2lnbmF0dXJl",
  "expiresAt": "2026-10-17T12:05:00Z",
  "scopes": [
    { "repository": "mirror/docker.io/library/postgres", "actions": ["pull"] }
  ]
}
